{
  "id": "emb-mcu",
  "code": "EMC",
  "title": "임베디드 SW · MCU 프로그래밍 (4일)",
  "subtitle": "GPIO·인터럽트·PWM · ADC·센서·I2C · FreeRTOS·Wi-Fi·디버깅",
  "course": "08 · 임베디드 · 시스템 SW",
  "source": "08-AI_CAMPUS-main/MCU-day1~4/MCU_Day*.pdf + MCU_Day*_lecture.md",
  "salt": "emb-mcu",
  "version": 1,
  "updated": "2026-10-16",
  "tabs": [
    {
      "id": "t1",
      "title": "ESP32 구조 · 빌드 과정",
      "ref": "MCU Day1 강의노트 1–2교시",
      "qs": [
        {
          "id": "t1-01",
          "ty": "mc",
          "lv": 1,
          "game": true,
          "p": "실습 보드의 ESP32 CPU 구성으로 옳은 것은?",
          "o": [
            "싱글코어 160MHz",
            "듀얼코어 240MHz",
            "쿼드코어 240MHz",
            "듀얼코어 80MHz"
          ],
          "a": 1,
          "h": "보드 표에서 ESP-32U 모듈 칸을 보면 Xtensa LX6 코어의 개수와 동작 클럭이 함께 적혀 있습니다. 코어가 하나가 아니라는 점과 클럭이 MHz 단위 세 자리 숫자라는 점을 떠올려 보세요.",
          "w": "ESP32는 Xtensa LX6 <b>듀얼코어 240MHz</b>이며 SRAM 520KB, Wi-Fi·Bluetooth를 갖습니다. 예제 2-1의 <code>ESP.getChipCores()</code>는 2, <code>ESP.getCpuFreqMHz()</code>는 240을 출력합니다.",
          "an": "MCU Day1 강의노트 1교시 예제 1-1 · 괄호 넣기 1-2",
          "src": "| ESP-32U 모듈 (금속 캔) | ESP32 칩 + 4MB Flash + 안테나 커넥터(U.FL). Xtensa LX6 **듀얼코어 240MHz**, SRAM 520KB, Wi-Fi · Bluetooth |\n| CP2102"
        },
        {
          "id": "t1-02",
          "ty": "mc",
          "lv": 1,
          "game": true,
          "p": "PC의 COM 포트로 보이며 USB와 UART를 변환해 주는 보드 위의 칩은?",
          "o": [
            "L293D",
            "74HC595",
            "Xtensa LX6",
            "CP2102"
          ],
          "a": 3,
          "h": "USB 신호를 UART로 바꿔 주는 칩이 PC에서 COMx 포트로 잡힙니다. 장치 관리자에 Silicon Labs 이름으로 보이는 정사각형 칩의 모델명을 떠올려 보세요.",
          "w": "CP2102가 USB ↔ UART 변환을 맡아 PC에 <code>COMx</code> 포트를 만듭니다. Xtensa LX6는 CPU 코어, 74HC595는 시프트 레지스터, L293D는 모터 드라이버입니다.",
          "an": "MCU Day1 강의노트 1교시 예제 1-1 · 2교시 A-6",
          "src": "부품 역할\nESP-32U 모듈 Xtensa LX6 듀얼코어 240MHz, SRAM 520KB, Flash 4MB, Wi-Fi · BT\nCP2102 USB ↔ UART 변환 . PC 의 COMx 포트가 바로 이 칩"
        },
        {
          "id": "t1-03",
          "ty": "mc",
          "lv": 2,
          "game": true,
          "p": "업로드할 때 앱 이미지(<code>.ino.bin</code>)가 기록되는 Flash 주소는?",
          "o": [
            "0x10000",
            "0x1000",
            "0x8000",
            "0xe000"
          ],
          "a": 0,
          "h": "Flash 4MB 앞부분은 bootloader, partitions, boot_app0, 앱 순서로 정해진 주소에 기록됩니다. bootloader가 0x1000, partitions가 0x8000에 쓰인 뒤 앱 이미지는 그보다 뒤쪽의 64KB 경계 주소에 놓입니다.",
          "w": "<code>write_flash</code>는 bootloader를 0x1000, 파티션 테이블을 0x8000, boot_app0를 0xe000, 앱 이미지를 <b>0x10000</b>에 씁니다. 전원이 켜지면 ROM → bootloader → 파티션 테이블 → 앱 순서로 시작합니다.",
          "an": "MCU Day1 강의노트 2교시 예제 2-2 · 괄호 넣기 2-2",
          "src": "Flash 4MB 앞부분 — esptool write_flash 가 쓰는 주소\n0x0000 0x1000\nbootloader\n0x8000\npartitions\n0xe000\nboot_app0\n0x10000\n 앱 (.ino.bin)"
        },
        {
          "id": "t1-04",
          "ty": "mc",
          "lv": 2,
          "game": true,
          "p": "Arduino-ESP32 core에서 <code>setup()</code>과 <code>loop()</code>를 호출하는 FreeRTOS 태스크 이름은?",
          "o": [
            "app_main",
            "initArduino",
            "loopTask",
            "idle"
          ],
          "a": 2,
          "h": "core 내부의 app_main()은 <code>xTaskCreatePinnedToCore()</code>로 태스크 하나를 core 1에 만들고, 그 태스크가 setup()을 한 번 부른 뒤 loop()를 무한 반복합니다. 직접 확인 코드에서 <code>pcTaskGetName(NULL)</code>이 출력하는 이름이 바로 그 태스크 이름입니다.",
          "w": "<code>app_main</code>이 <code>loopTask</code>를 core 1에 만들고, 그 안에서 <code>setup()</code>을 한 번, <code>loop()</code>를 무한 반복합니다. app_main은 ESP-IDF의 진짜 시작점일 뿐 setup/loop를 직접 반복하지 않습니다.",
          "an": "MCU Day1 강의노트 2교시 예제 2-3",
          "src": "Arduino-ESP32 core 내부(간략화):\n```c\nextern \"C\" void app_main() { // ESP-IDF 의 진짜 시작점\n initArduino();\n xTaskCreatePinnedToCore(loopTask, \"loopTask\", 8192, NULL, 1, NULL, 1); // core 1\n}\n\nvoid loopTask(void *arg) {\n setup(); // 한 번\n for (;;) {\n loop(); // 무한 반복"
        },
        {
          "id": "t1-05",
          "ty": "mc",
          "lv": 3,
          "game": true,
          "p": "업로드 로그가 <code>Connecting....</code>에서 멈췄습니다. 올바른 조치는?",
          "o": [
            "EN 버튼을 한 번 누른다",
            "Boot 버튼을 누르고 있는다",
            "시리얼 모니터를 9600으로",
            "보드를 다시 선택한다"
          ],
          "a": 1,
          "h": "Connecting 단계에서 멈추는 것은 칩이 다운로드 모드로 들어가지 못했기 때문입니다. 누른 채 리셋하면 GPIO 0을 LOW로 만들어 다운로드 모드로 진입시키는 버튼이 무엇인지 떠올려 보세요.",
          "w": "Connecting 동안 <b>Boot 버튼</b>을 누르고 있다가 <code>Writing at 0x...</code>가 나오면 손을 뗍니다. EN 버튼은 리셋, 9600 baud 변경은 시리얼 출력 속도 문제와 관련됩니다.",
          "an": "MCU Day1 강의노트 2교시 B-3 · 예제 2-4",
          "src": "| 증상 | 조치 |\n|---|---|\n| 포트가 보이지 않음 | 데이터 케이블로 교체, CP2102 드라이버 설치 |\n| `Failed to connect to ESP32` | \"Connecting...\" 동안 Boot 버튼을 누르고 있기 |\n| 업로드 도중 끊김"
        },
        {
          "id": "t1-06",
          "ty": "ox",
          "lv": 1,
          "game": true,
          "p": "GPIO 34에 LED를 연결하고 <code>digitalWrite(34, HIGH)</code>를 하면 LED가 켜진다.",
          "a": false,
          "h": "GPIO 34~39번은 입력 전용 핀이라 출력 회로가 없습니다. 그래서 출력 함수를 호출해도 핀 전압이 바뀌지 않는다는 점을 떠올려 보세요.",
          "w": "GPIO 34~39는 <b>입력 전용</b>이라 출력이 불가능하고 내부 풀업도 없습니다. 아무 일도 일어나지 않는 것이 이 함정의 결과입니다.",
          "an": "MCU Day1 강의노트 1교시 예제 1-2 · 1-3",
          "src": "| GPIO 34 에 LED 연결 후 `digitalWrite(34, HIGH)` | 아무 일도 없음 — 입력 전용 핀 |"
        },
        {
          "id": "t1-07",
          "ty": "ox",
          "lv": 2,
          "game": true,
          "p": "시리얼 모니터 속도를 9600으로 두어 글자가 깨지는 것은 코드에 버그가 있다는 뜻이다.",
          "a": false,
          "h": "보드와 시리얼 모니터의 baud가 다르면 비트를 읽는 간격이 달라 바이트가 엉뚱하게 조립됩니다. 속도를 115200으로 다시 맞추면 정상 출력이 보인다는 점에서 원인이 어디에 있는지 판단해 보세요.",
          "w": "코드의 <code>Serial.begin(115200)</code>과 모니터 속도가 다르면 비트를 읽는 간격이 달라 바이트가 엉뚱하게 조립됩니다. 코드 문제가 아니라 baud 설정 문제이므로 115200으로 맞추면 됩니다.",
          "an": "MCU Day1 강의노트 2교시 예제 2-4",
          "src": "양쪽 속도(baud)가 다르면 비트를 읽는 간격이 달라 **바이트가 엉뚱하게 조립**됩니다. 코드 문제가 아닙니다."
        },
        {
          "id": "t1-08",
          "ty": "match",
          "lv": 1,
          "game": false,
          "p": "ESP32 핀 분류와 해당 핀을 연결하세요.",
          "pairs": [
            [
              "입력 전용",
              "34 · 35 · 36 · 39"
            ],
            [
              "Strapping (부팅 모드 결정)",
              "0 · 2 · 5 · 12 · 15"
            ],
            [
              "Flash 연결 (사용 금지)",
              "6 ~ 11"
            ],
            [
              "UART0 (업로드·모니터)",
              "1(TX) · 3(RX)"
            ]
          ],
          "h": "핀 분류표에서 34번 이후는 출력 불가 핀, 부팅 순간 전압으로 모드가 정해지는 핀은 0·2·5·12·15입니다. 6~11번은 내부 Flash 선, 1번과 3번은 업로드와 시리얼 모니터가 쓰는 UART0 핀이라는 점을 맞춰 보세요.",
          "w": "입력 전용(34~39)은 출력·풀업이 없고, Strapping 핀은 부팅 순간 전압으로 모드가 정해지며 특히 12는 피합니다. Flash 연결 핀(6~11)을 쓰면 부팅이 안 되고, 1·3번은 업로드와 시리얼 모니터가 사용합니다.",
          "an": "MCU Day1 강의노트 1교시 예제 1-2 핀 분류표",
          "src": "| 입력 전용 | 34, 35, 36(VP), 39(VN) | 출력 불가, **내부 풀업 없음**. 아날로그 센서 전용 (Day 2) |\n| Strapping | 0, 2, 5, 12, 15 | 부팅 순간의 전압으로 동작 모드가 정해짐. **12 는 피한다** |\n| Flash 연결 | 6, 7, 8, 9, 10, 11 (보드 표기 CLK, D0~D3, CMD) | **절대 사용 금지** — 연결하면 부팅 불가 |\n| UART0 | 1(TX), 3(RX) | 업로드와 시리얼 모니터가 사용 중 |"
        },
        {
          "id": "t1-09",
          "ty": "order",
          "lv": 2,
          "game": false,
          "p": "스케치가 보드에서 실행되기까지의 빌드 단계를 순서대로 놓으세요.",
          "steps": [
            "전처리: .ino → .ino.cpp (함수 원형 자동 추가)",
            "컴파일: xtensa-esp32-elf-g++ → .o",
            "링크: core 라이브러리와 결합 → .elf",
            "이미지 변환: esptool elf2image → .bin",
            "업로드: write_flash로 Flash에 기록"
          ],
          "h": "C 과정의 gcc 흐름(전처리 → 컴파일 → 링크)에 ESP32만의 단계가 덧붙습니다. 링크로 만든 .elf를 esptool이 .bin으로 바꾼 다음에야 write_flash로 칩에 기록할 수 있다는 순서를 떠올려 보세요.",
          "w": "PC의 gcc처럼 전처리 → 컴파일 → 링크를 거친 뒤, MCU에는 OS가 없으므로 esptool이 .elf를 .bin 이미지로 바꿔 Flash의 정해진 주소에 직접 씁니다.",
          "an": "MCU Day1 강의노트 2교시 예제 2-2 빌드 로그 표",
          "src": "| 단계 | 로그에서 찾을 것 | C 과정 대응 |\n|---|---|---|\n| 1. 스케치 전처리 | `.ino` → `hello_esp32.ino.cpp` (함수 원형 자동 추가) | 전처리 |\n| 2. 컴파일 | `xtensa-esp32-elf-g++ ... -c ... -o hello_esp32.ino.cpp.o` | `gcc -c` |\n| 3. 링크 | `... -o hello_esp32.ino.elf` (core 라이브러리와 결합) | 링크 |\n| 4. 이미지 변환 | `esptool ... elf2image` → `hello_esp32.ino.bin` | (PC 에는 없음) |"
        },
        {
          "id": "t1-10",
          "ty": "multi",
          "lv": 3,
          "game": true,
          "p": "<code>is_safe_output()</code> 기준으로 출력에 쓰면 <b>안 되는</b> 핀을 모두 고르세요.",
          "o": [
            "GPIO 25",
            "GPIO 34",
            "GPIO 9",
            "GPIO 12",
            "GPIO 4"
          ],
          "a": [
            1,
            2,
            3
          ],
          "h": "<code>is_safe_output()</code>은 34~39번 입력 전용 핀, 6~11번 Flash 핀, 0·2·5·12·15번 Strapping 핀, UART0 핀을 모두 0으로 돌려줍니다. 보기의 각 핀이 이 네 목록 중 어디에 속하는지 하나씩 대조해 보세요.",
          "w": "34는 입력 전용, 9는 Flash 연결, 12는 Strapping 핀이라 NO가 나옵니다. 25와 4는 일반 GPIO라 OK이며, 오늘 실습도 이 범위에서 핀을 고릅니다.",
          "an": "MCU Day1 강의노트 1교시 빈칸 채우기 1-1",
          "src": "분류 핀 규칙\n일반 GPIO 4 13 14 16 17 18 19 21 22 23 25 26 27 32 33 오늘 쓰는 핀은 전부 여기서\n입력 전용 34 35 36(VP) 39(VN) 출력 불가 , 내부 풀업 없음 → Day 2 아날로그\nStrapping 0 2 5 12 15 부팅 모드 결정 . 12 는 특히 피한다\nFlash 6 7 8 9 10 11 (CLK D0~D3 CMD) 절대 금지 — 부팅 불가\nUART0 1(TX) 3(RX) 업로드 · 시리얼 모니터가 사용 중\n전원 3V3 5V GND EN 5V 는 USB 전원 그대로 . GPIO 에 연결 금지\n⚠ GPIO 34 에 LED → 아무 일도 없음 . GPIO 9 에 부품 → 무한 리셋 . GPIO 12 에 풀업 부품 → 업로드 · 부팅 실패 ."
        }
      ]
    },
    {
      "id": "t2",
      "title": "디지털 출력 · 레지스터 · 입력",
      "ref": "MCU Day1 강의노트 3–5교시",
      "qs": [
        {
          "id": "t2-01",
          "ty": "num",
          "lv": 3,
          "game": false,
          "p": "빨강 LED(순방향 전압 Vf 2.0V)를 3.3V GPIO에 220Ω 저항으로 연결했습니다. LED 전류는 약 몇 mA입니까? (소수 첫째 자리)",
          "a": 5.9,
          "unit": "mA",
          "tol": 0.1,